{
  "version": "1.0",
  "title": "The Chronicles of the Smith Family",
  "last_updated": "2026-01-03T15:27:40Z",
  "categories": [
    {
      "id": "education",
      "label": "Education & Job",
      "color": "#4A90D9"
    },
    {
      "id": "family",
      "label": "Family & Friends",
      "color": "#E57373"
    },
    {
      "id": "travel",
      "label": "Travels & Holidays",
      "color": "#81C784"
    },
    {
      "id": "hobby",
      "label": "Hobbies & Interests",
      "color": "#FFD54F"
    },
    {
      "id": "circumstance",
      "label": "Circumstances & Events",
      "color": "#9575CD"
    }
  ],
  "persons": [
    {
      "id": "alice",
      "name": "Alice Smith",
      "facts": [
        {
          "id": "a1b2c3d4-e5f6-7890-abcd-ef1234567890",
          "date": "1990-05-15",
          "category": "family",
          "text": "Born in Springfield"
        },
        {
          "id": "b2c3d4e5-f6a7-8901-bcde-f12345678901",
          "date": "1996",
          "category": "education",
          "text": "Started elementary school"
        },
        {
          "id": "c3d4e5f6-a7b8-9012-cdef-123456789012",
          "date": "2002",
          "category": "hobby",
          "text": "Started playing piano"
        },
        {
          "id": "d4e5f6a7-b8c9-0123-def0-234567890123",
          "date": "2008",
          "category": "education",
          "text": "Graduated high school"
        },
        {
          "id": "e5f6a7b8-c9d0-1234-ef01-345678901234",
          "date": "2012",
          "category": "education",
          "text": "Bachelor's degree in Computer Science"
        },
        {
          "id": "f6a7b8c9-d0e1-2345-f012-456789012345",
          "date": "2015",
          "category": "family",
          "text": "Married Bob",
          "with": [
            "bob"
          ]
        },
        {
          "id": "a7b8c9d0-e1f2-3456-0123-567890123456",
          "date": "2018",
          "category": "travel",
          "text": "Trip to Japan",
          "with": [
            "bob"
          ],
          "location": {
            "country": "Japan",
            "place": "Tokyo",
            "coordinates": {
              "lat": 35.6762,
              "lon": 139.6503
            }
          },
          "attachments": [
            {
              "url": "file:///photos/2018/tokyo-tower.jpg",
              "content_type": "image/jpeg",
              "title": "Tokyo Tower at sunset"
            },
            {
              "url": "file:///photos/2018/shibuya.jpg",
              "content_type": "image/jpeg",
              "title": "Shibuya Crossing"
            }
          ]
        },
        {
          "id": "b8c9d0e1-f2a3-4567-1234-678901234567",
          "date": "2020",
          "category": "circumstance",
          "text": "Moved to new house in Shelbyville"
        },
        {
          "id": "e20ae941-3391-43d5-bb6d-721d20d5c0ea",
          "date": "2025-10-17",
          "category": "travel",
          "text": "Mountain retreat with friends",
          "with": [
            "bob"
          ],
          "location": {
            "country": "CH",
            "place": "Mettmenalp, Schwändi",
            "coordinates": {
              "lat": 46.960566,
              "lon": 9.099201
            }
          }
        }
      ]
    },
    {
      "id": "bob",
      "name": "Bob Johnson",
      "facts": [
        {
          "id": "c9d0e1f2-a3b4-5678-2345-789012345678",
          "date": "1988-03-22",
          "category": "family",
          "text": "Born in Capital City"
        },
        {
          "id": "d0e1f2a3-b4c5-6789-3456-890123456789",
          "date": "2010",
          "category": "education",
          "text": "Started working as engineer"
        },
        {
          "id": "e1f2a3b4-c5d6-7890-4567-901234567890",
          "date": "2015",
          "category": "family",
          "text": "Married Alice",
          "with": [
            "alice"
          ],
          "location": {
            "country": "USA",
            "place": "Springfield",
            "coordinates": {
              "lat": 39.7990175,
              "lon": -89.6439575
            }
          },
          "attachments": [
            {
              "url": "s3://family-photos/wedding/ceremony.jpg",
              "content_type": "image/jpeg",
              "title": "Wedding ceremony"
            }
          ]
        },
        {
          "id": "f2a3b4c5-d6e7-8901-5678-012345678901",
          "date": "2018",
          "category": "travel",
          "text": "Trip to Japan",
          "with": [
            "alice"
          ],
          "location": {
            "country": "Japan",
            "place": "Tokyo",
            "coordinates": {
              "lat": 35.6762,
              "lon": 139.6503
            }
          }
        },
        {
          "id": "a3b4c5d6-e7f8-9012-6789-123456789012",
          "date": "2022?",
          "category": "hobby",
          "text": "Started woodworking"
        }
      ]
    }
  ]
}